personnage,replique
DON CARLOS,"Je sais la différence, mon frère, qu'un gentilhomme doit
toujours mettre entre l'un et l'autre, et la reconnaissance
de l'obligation n'efface point en moi le ressentiment de
l'injure ; mais souffrez que je lui rende ici ce qu'il m'a
prêté, que je m'acquitte sur-le-champ de la vie que je lui
dois, par un délai de notre vengeance, et lui laisse la
liberté de jouir, durant quelques jours, du fruit de son
bienfait. 
- 48 -"
DON CARLOS,"De grâce, mon frère... 
DON ALONSE.
Tous ces discours sont superflus : il faut qu'il meure."
DON CARLOS,"Arrêtez-vous, dis-je, mon frère. Je ne souffrirai point du
tout qu'on attaque ses jours, et je jure le Ciel que je le
défendrai ici contre qui que ce soit, et je saurai lui faire
un rempart de cette même vie qu'il a sauvée ; et pour
adresser vos coups, il faudra que vous me perciez. 
DON ALONSE.
Quoi ? Vous prenez le parti de notre ennemi contre moi ;
et loin d'être saisi à son aspect des mêmes transports que
je sens, vous faites voir pour lui des sentiments pleins de
douceur ?"
DON CARLOS,"Mon frère, montrons de la modération dans une action
légitime, et ne vengeons point notre honneur avec cet
emportement que vous témoignez. Ayons du coeur dont
nous soyons les maîtres, une valeur qui n'ait rien de
farouche, et qui se porte aux choses par une pure
délibération de notre raison, et non point par le
mouvement d'une aveugle colère. Je ne veux point, mon
frère, demeurer redevable à mon ennemi, et je lui ai une
obligation dont il faut que je m'acquitte avant toute
chose. Notre vengeance, pour être différée, n'en sera pas
moins éclatante : au contraire, elle en tirera de l'avantage
; et cette occasion de l'avoir pu prendre la fera paraître
plus juste aux yeux de tout le monde. 
DON ALONSE.
Ô l'étrange faiblesse, et l'aveuglement effroyable
d'hasarder ainsi les intérêts de son honneur pour la
ridicule pensée d'une obligation chimérique ! 
- 49 -"
DON CARLOS,"Non, mon frère, ne vous mettez pas en peine. Si je fais
une faute, je saurai bien la réparer, et je me charge de
tout le soin de notre honneur ; je sais à quoi il nous
oblige, et cette suspension d'un jour, que ma
reconnaissance lui demande, ne fera qu'augmenter
l'ardeur que j'ai de le satisfaire. Don Juan, vous voyez
que j'ai soin de vous rendre le bien que j'ai reçu de vous,
et vous devez par là juger du reste, croire que je
m'acquitte avec même chaleur de ce que je dois, et que je
ne serai pas moins exact à vous payer l'injure que le
bienfait. Je ne veux point vous obliger ici à expliquer vos
sentiments, et je vous donne la liberté de penser à loisir
aux résolutions que vous avez à prendre. Vous
connaissez assez la grandeur de l'offense que vous nous
avez faite, et je vous fais juge vous-même des réparations
qu'elle demande. Il est des moyens doux pour nous
satisfaire ; il en est de violents et de sanglants ; mais
enfin, quelque choix que vous fassiez, vous m'avez donné
parole de me faire faire raison par Don Juan : songez à
me la faire, je vous prie, et vous ressouvenez que, hors
d'ici, je ne dois plus qu'à mon honneur."
DON JUAN,"Je n'ai rien exigé de vous, et vous tiendrai ce que j'ai
promis."
DON CARLOS,"Allons, mon frère : un moment de douceur ne fait aucune
injure à la sévérité de notre devoir. 
- 50 -"
DON JUAN,"Holà, hé, Sganarelle !"
SGANARELLE,Plaît-il ?
DON JUAN,"Comment ? coquin, tu fuis quand on m'attaque ?"
SGANARELLE,"Pardonnez-moi, Monsieur ; je viens seulement d'ici près.
Je crois que cet habit est purgatif, et que c'est prendre
médecine que de le porter."
DON JUAN,"Peste soit l'insolent ! Couvre au moins ta poltronnerie
d'un voile plus honnête. Sais-tu bien qui est celui à qui
j'ai sauvé la vie ?"
SGANARELLE,Moi ? Non.
DON JUAN,C'est un frère d'Elvire.
SGANARELLE,Un...
DON JUAN,"Il est assez honnête homme, il en a bien usé, et j'ai regret
d'avoir démêlé avec lui."
SGANARELLE,Il vous serait aisé de pacifier toutes choses.
DON JUAN,"Oui ; mais ma passion est usée pour Done Elvire, et
l'engagement ne compatit point avec mon humeur. J'aime
la liberté en amour, tu le sais, et je ne saurais me résoudre
à renfermer mon coeur entre quatre murailles. Je te l'ai dit
vingt fois, j'ai une pente naturelle à me laisser aller à tout
ce qui m'attire. Mon coeur est à toutes les belles, et c'est à
elles à le prendre tour à tour et à le garder tant qu'elles le
pourront. Mais quel est le superbe édifice que je vois
- 51 -"
SGANARELLE,Vous ne le savez pas ?
DON JUAN,"Non, vraiment."
SGANARELLE,"Bon ! C'est le tombeau que le Commandeur faisait faire
lorsque vous le tuâtes."
DON JUAN,"Ah ! Tu as raison. Je ne savais pas que c'était de ce
côté-ci qu'il était. Tout le monde m'a dit des merveilles
de cet ouvrage, aussi bien que de la statue du
Commandeur, et j'ai envie de l'aller voir."
SGANARELLE,"Monsieur, n'allez point là."
DON JUAN,Pourquoi ?
SGANARELLE,"Cela n'est pas civil, d'aller voir un homme que vous avez
tué."
DON JUAN,"Au contraire, c'est une visite dont je lui veux faire
civilité, et qu'il doit recevoir de bonne grâce, s'il est
galant homme. Allons, entrons dedans. 
Le tombeau s'ouvre, où l'on voit un superbe mausolée et la statue du
Commandeur."
SGANARELLE,"Ah ! Que cela est beau ! Les belles statues ! Le beau
marbre ! Les beaux piliers ! Ah ! Que cela est beau !
Qu'en dites-vous, Monsieur ?"
DON JUAN,"Qu'on ne peut voir aller plus loin l'ambition d'un homme
mort ; et ce que je trouve admirable, c'est qu'un homme
qui s'est passé, durant sa vie, d'une assez simple demeure,
en veuille avoir une si magnifique pour quand il n'en a
plus que faire. 
- 52 -"
SGANARELLE,Voici la statue du Commandeur.
DON JUAN,"Parbleu ! Le voilà bon, avec son habit d'empereur romain
!"
SGANARELLE,"Ma foi, Monsieur, voilà qui est bien fait. Il semble qu'il
est en vie, et qu'il s'en va parler. Il jette des regards sur
nous qui me feraient peur, si j'étais tout seul, et je pense
qu'il ne prend pas plaisir de nous voir."
DON JUAN,"Il aurait tort, et ce serait mal recevoir l'honneur que je lui
fais. Demande-lui s'il veut venir souper avec moi."
SGANARELLE,"C'est une chose dont il n'a pas besoin, je crois."
DON JUAN,"Demande-lui, te dis-je."
SGANARELLE,"Vous moquez-vous ? Ce serait être fou que d'aller parler
à une statue."
DON JUAN,Fais ce que je te dis.
SGANARELLE,"Quelle bizarrerie ! Seigneur Commandeur... Je ris de ma
sottise, mais c'est mon maître qui me la fait faire.
Seigneur Commandeur, mon maître Don Juan vous
demande si vous voulez lui faire l'honneur de venir
souper avec lui. 
La Statue baisse la tête.
Ha !"
DON JUAN,"Qu'est-ce ? Qu'as-tu ? Dis donc, veux-tu parler ? 
- 53 -"
SGANARELLE,"fait le même signe que lui a fait la
Statue et baisse la tête.
La Statue..."
DON JUAN,"Eh bien ! Que veux-tu dire, traître ?"
SGANARELLE,Je vous dis que la Statue...
DON JUAN,"Eh bien ! La Statue ? Je t'assomme, si tu ne parles."
SGANARELLE,La Statue m'a fait signe.
DON JUAN,La peste le coquin !
SGANARELLE,"Elle m'a fait signe, vous dis-je : il n'est rien de plus vrai.
Allez-vous-en lui parler vous-même pour voir.
Peut-être..."
DON JUAN,"Viens, maraud, viens, je te veux bien faire toucher au
doigt ta poltronnerie. Prends garde. Le Seigneur
Commandeur voudrait-il venir souper avec moi ? 
La Statue baisse encore la tête."
SGANARELLE,"Je ne voudrais pas en tenir dix pistoles. Eh bien !
Monsieur ?"
DON JUAN,"Allons, sortons d'ici."
SGANARELLE,"Voilà de mes esprits forts, qui ne veulent rien croire. 
- 54 -"
DON JUAN,"Quoi qu'il en soit, laissons cela : c'est une bagatelle, et
nous pouvons avoir été trompés par un faux jour, ou
surpris de quelque vapeur qui nous ait troublé la vue."
SGANARELLE,"Eh ! Monsieur, ne cherchez point à démentir ce que nous
avons vu des yeux que voilà. Il n'est rien de plus véritable
que ce signe de tête ; et je ne doute point que le Ciel,
scandalisé de votre vie, n'ait produit ce miracle pour vous
convaincre, et pour vous retirer de..."
DON JUAN,"Écoute. Si tu m'importunes davantage de tes sottes
moralités, si tu me dis encore le moindre mot là-dessus,
je vais appeler quelqu'un, demander un nerf de boeuf, te
faire tenir par trois ou quatre, et te rouer de mille coups.
M'entends-tu bien ?"
SGANARELLE,"Fort bien, Monsieur, le mieux du monde. Vous vous
expliquez clairement ; c'est ce qu'il y a de bon en vous,
que vous n'allez point chercher de détours : vous dites les
choses avec une netteté admirable."
DON JUAN,"Allons, qu'on me fasse souper le plus tôt que l'on pourra.
Une chaise, petit garçon. 
- 55 -"
LA VIOLETTE,"Monsieur, voilà votre marchand, Monsieur Dimanche,
qui demande à vous parler."
SGANARELLE,"Bon, voilà ce qu'il nous faut, qu'un compliment de
créancier. De quoi s'avise-t-il de nous venir demander de
l'argent, et que ne lui disais-tu que Monsieur n'y est pas ?"
LA VIOLETTE,"Il y a trois quarts d'heure que je lui dis ; mais il ne veut
pas le croire, et s'est assis là dedans pour attendre."
SGANARELLE,"Qu'il attende, tant qu'il voudra."
DON JUAN,"Non, au contraire, faites-le entrer. C'est une fort mauvaise
politique que de se faire celer aux créanciers. Il est bon
de les payer de quelque chose, et j'ai le secret de les
renvoyer satisfaits sans leur donner un double. 
SCÈNE III.
Don Juan, Monsieur Dimanche, Sganarelle,
Suite."
DON JUAN,"Comment ? Vous dire que je n'y suis pas, à M.
Dimanche, au meilleur de mes amis ? 
Monsieur DIMANCHE
Monsieur, je suis votre serviteur : j'étais venu..."
DON JUAN,"Allons vite, un siège pour M. Dimanche. 
Monsieur DIMANCHE
Monsieur, je suis bien comme cela."
DON JUAN,"Point, point, je veux que vous soyez assis contre moi. 
Monsieur DIMANCHE
Cela n'est point nécessaire."
DON JUAN,"Pliant : siège pliant. Le fauteuil est
destiné aux personnes de qualité, il est
le siège le plus honorable.Ôtez ce pliant, et apportez un fauteuil. 
Monsieur DIMANCHE
Monsieur, vous vous moquez, et..."
DON JUAN,"Non, non, je sais ce que je vous dois, et je ne veux point
qu'on mette de différence entre nous deux. 
Monsieur DIMANCHE
Monsieur..."
DON JUAN,"Allons, asseyez-vous. 
Monsieur DIMANCHE
Il n'est pas besoin, Monsieur, et je n'ai qu'un mot à vous
dire. J'étais... 
- 57 -"
DON JUAN,"Mettez-vous là, vous dis-je. 
Monsieur DIMANCHE
Non, Monsieur, je suis bien. Je viens pour..."
DON JUAN,"Non, je ne vous écoute point si vous n'êtes assis. 
Monsieur DIMANCHE
Monsieur, je fais ce que vous voulez. Je..."
DON JUAN,"Parbleu ! Monsieur Dimanche, vous vous portez bien. 
Monsieur DIMANCHE
Oui, Monsieur, pour vous rendre service. Je suis venu..."
DON JUAN,"Vous avez un fonds de santé admirable, des lèvres
fraîches, un teint vermeil, et des yeux vifs. 
Monsieur DIMANCHE
Je voudrais bien..."
DON JUAN,"Comment se porte Madame Dimanche, votre épouse ? 
Monsieur DIMANCHE
Fort bien, Monsieur, Dieu merci."
DON JUAN,"C'est une brave femme. 
Monsieur DIMANCHE
Elle est votre servante, Monsieur. Je venais..."
DON JUAN,"Et votre petite fille Claudine, comment se porte-t-elle ? 
- 58 -"
DON JUAN,"La jolie petite fille que c'est ! Je l'aime de tout mon
coeur. 
Monsieur DIMANCHE
C'est trop d'honneur que vous lui faites, Monsieur. Je
vous..."
DON JUAN,"Et le petit Colin, fait-il toujours bien du bruit avec son
tambour ? 
Monsieur DIMANCHE
Toujours de même, Monsieur. Je..."
DON JUAN,"Et votre petit chien Brusquet ? Gronde-t-il toujours aussi
fort, et mord-il toujours bien aux jambes les gens qui
vont chez vous ? 
Monsieur DIMANCHE
Chévir : être maître de quelqu'un, de
quelque chose. ""Cet enfant est si
malin, qu'il n'y a que sa nourrice qui
puisse chévir de lui."" (Dict. Furetière)Plus que jamais, Monsieur, et nous ne saurions en chévir."
DON JUAN,"Ne vous étonnez pas si je m'informe des nouvelles de
toute la famille, car j'y prends beaucoup d'intérêt. 
Monsieur DIMANCHE
Nous vous sommes, Monsieur, infiniment obligés. Je..."
DON JUAN,"Parbleu ! Je suis à vous de tout mon coeur. 
- 59 -"
DON JUAN,"Il n'y a rien que je ne fisse pour vous. 
Monsieur DIMANCHE
Monsieur, vous avez trop de bonté pour moi."
DON JUAN,"Et cela sans intérêt, je vous prie de le croire. 
Monsieur DIMANCHE
Je n'ai point mérité cette grâce assurément. Mais,
Monsieur..."
DON JUAN,"Oh ! çà, Monsieur Dimanche, sans façon, voulez-vous
souper avec moi ? 
Monsieur DIMANCHE
Non, Monsieur, il faut que je m'en retourne tout à l'heure.
Je..."
DON JUAN,"Comment ? Je veux qu'on vous escorte, et je m'intéresse
trop à votre personne. Je suis votre serviteur, et de plus
votre débiteur. 
Monsieur DIMANCHE
Ah ! Monsieur..."
DON JUAN,"C'est une chose que je ne cache pas, et je le dis à tout le
monde. 
- 60 -"
DON JUAN,"Voulez-vous que je vous reconduise ? 
Monsieur DIMANCHE
Ah ! Monsieur, vous vous moquez, Monsieur..."
DON JUAN,"Embrassez-moi donc, s'il vous plaît. Je vous prie encore
une fois d'être persuadé que je suis tout à vous, et qu'il
n'y a rien au monde que je ne fisse pour votre service. 
Il sort."
SGANARELLE,"Il faut avouer que vous avez en Monsieur un homme qui
vous aime bien. 
Monsieur DIMANCHE
Il est vrai ; il me fait tant de civilités et tant de
compliments que je ne saurais jamais lui demander de
l'argent."
SGANARELLE,"Je vous assure que toute sa maison périrait pour vous ; et
je voudrais qu'il vous arrivât quelque chose, que
quelqu'un s'avisât de vous donner des coups de bâton ;
vous verriez de quelle manière... 
Monsieur DIMANCHE
Je le crois ; mais, Sganarelle, je vous prie de lui dire un
petit mot de mon argent."
SGANARELLE,"Oh ! Ne vous mettez pas en peine, il vous payera le
mieux du monde. 
Monsieur DIMANCHE
Mais vous, Sganarelle, vous me devez quelque chose en
votre particulier."
SGANARELLE,"Fi ! Ne parlez pas de cela. 
- 61 -"
SGANARELLE,"Ne sais-je pas bien que je vous dois ? 
Monsieur DIMANCHE
Oui, mais..."
SGANARELLE,"Allons, Monsieur Dimanche, je vais vous éclairer. 
Monsieur DIMANCHE
Mais mon argent..."
LA VIOLETTE,"Monsieur, voilà Monsieur votre père."
DON JUAN,"Ah ! Me voici bien : il me fallait cette visite pour me
faire enrager."
DON LOUIS,"Je vois bien que je vous embarrasse et que vous vous
passeriez fort aisément de ma venue. À dire vrai, nous
nous incommodons étrangement l'un et l'autre ; et si vous
êtes las de me voir, je suis bien las aussi de vos
déportements. Hélas ! Que nous savons peu ce que nous
faisons quand nous ne laissons pas au Ciel le soin des
choses qu'il nous faut, quand nous voulons être plus
avisés que lui, et que nous venons à l'importuner par nos
souhaits aveugles et nos demandes inconsidérées ! J'ai
souhaité un fils avec des ardeurs non pareilles ; je l'ai
demandé sans relâche avec des transports incroyables ; et
ce fils, que j'obtiens en fatiguant le Ciel de voux, est le
chagrin et le supplice de cette vie même dont je croyais
qu'il devait être la joie et la consolation. De quel oeil, à
votre avis, pensez-vous que je puisse voir cet amas
d'actions indignes, dont on a peine, aux yeux du monde,
d'adoucir le mauvais visage, cette suite continuelle de
méchantes affaires, qui nous réduisent, à toutes heures, à
lasser les bontés du Souverain, et qui ont épuisé auprès
de lui le mérite de mes services et le crédit de mes amis ?
Ah ! Quelle bassesse est la vôtre ! Ne rougissez-vous
point de mériter si peu votre naissance ? Êtes-vous en
droit, dites-moi, d'en tirer quelque vanité ? Et
qu'avez-vous fait dans le monde pour être gentilhomme ?
Croyez-vous qu'il suffise d'en porter le nom et les armes,
et que ce nous soit une gloire d'être sorti d'un sang noble
lorsque nous vivons en infâmes ? Non, non, la naissance
n'est rien où la vertu n'est pas. Aussi nous n'avons part à
la gloire de nos ancêtres qu'autant que nous nous
efforçons de leur ressembler ; et cet éclat de leurs actions
qu'ils répandent sur nous, nous impose un engagement de
leur faire le même honneur, de suivre les pas qu'ils nous
tracent, et de ne point dégénérer de leurs vertus, si nous
voulons être estimés leurs véritables descendants. Ainsi
vous descendez en vain des aïeux dont vous êtes né : ils
vous désavouent pour leur sang, et tout ce qu'ils ont fait
d'illustre ne vous donne aucun avantage ; au contraire,
- 63 -"
DON JUAN,"Monsieur, si vous étiez assis, vous en seriez mieux pour
parler."
DON LOUIS,"Non, insolent, je ne veux point m'asseoir, ni parler
davantage, et je vois bien que toutes mes paroles ne font
rien sur ton âme. Mais sache, fils indigne, que la
tendresse paternelle est poussée à bout par tes actions,
que je saurai, plus tôt que tu ne penses, mettre une borne
à tes dérèglements, prévenir sur toi le courroux du Ciel,
et laver par ta punition la honte de t'avoir fait naître. 
Il sort.
SCÈNE V.
Don Juan, Sganarelle."
DON JUAN,"Eh ! Mourez le plus tôt que vous pourrez, c'est le mieux
que vous puissiez faire. Il faut que chacun ait son tour, et
j'enrage de voir des pères qui vivent autant que leurs fils. 
Il se met dans son fauteuil."
SGANARELLE,"Ah ! Monsieur, vous avez tort."
DON JUAN,J'ai tort ?
SGANARELLE,Monsieur...
SGANARELLE,"Oui, Monsieur, vous avez tort d'avoir souffert ce qu'il
vous a dit, et vous le deviez mettre dehors par les
épaules. A-t-on jamais rien vu de plus impertinent ? Un
père venir faire des remontrances à son fils, et lui dire de
corriger ses actions, de se ressouvenir de sa naissance, de
mener une vie d'honnête homme, et cent autres sottises
de pareille nature ! Cela se peut-il souffrir à un homme
comme vous, qui savez comme il faut vivre ? J'admire
votre patience ; et si j'avais été en votre place, je l'aurais
envoyé promener. 
À part.
Ô complaisance maudite ! À quoi me réduis-tu ?"
DON JUAN,"Me fera-t-on souper bientôt ? 
SCÈNE VI.
Don Juan, Dona Elvire, Ragotin, Sganarelle."
RAGOTIN,"Monsieur, voici une dame voilée qui vient vous parler."
DON JUAN,Que pourrait-ce être ?
SGANARELLE,"Il faut voir. 
DONA"
ELVIRE,"Ne soyez point surpris, Don Juan, de me voir à cette
heure et dans cet équipage. C'est un motif pressant qui
m'oblige à cette visite, et ce que j'ai à vous dire ne veut
point du tout de retardement. Je ne viens point ici pleine
de ce courroux que j'ai tantôt fait éclater, et vous me
voyez bien changée de ce que j'étais ce marin. Ce n'est
plus cette Dona Elvire qui faisait des voux contre vous, et
dont l'âme irritée ne jetait que menaces et ne respirait que
vengeance. Le Ciel a banni de mon âme toutes ces
insignes ardeurs que je sentais pour vous, tous ces
transports tumultueux d'un attachement criminel, tous ces
honteux emportements d'un amour terrestre et grossier ;
et il n'a laissé dans mon coeur pour vous qu'une flamme
épurée de tout le commerce des sens, une tendresse toute
sainte, un amour détaché de tout, qui n'agit point pour
soi, et ne se met en peine que de votre intérêt. 
- 65 -"
SGANARELLE,"Pardonnez-moi. 
DONA"
ELVIRE,"C'est ce parfait et pur amour qui me conduit ici pour
votre bien, pour vous faire part d'un avis du Ciel, et
tâcher de vous retirer du précipice où vous courez. Oui,
Don Juan, je sais tous les dérèglements de votre vie, et ce
même Ciel, qui m'a touché le coeur et fait jeter les yeux
sur les égarements de ma conduite, m'a inspiré de vous
venir trouver, et de vous dire, de sa part, que vos offenses
ont épuisé sa miséricorde, que sa colère redoutable est
prête de tomber sur vous, qu'il est en vous de l'éviter par
un prompt repentir, et que peut-être vous n'avez pas
encore un jour à vous pouvoir soustraire au plus grand de
tous les malheurs. Pour moi, je ne tiens plus à vous par
aucun attachement du monde ; je suis revenue, grâces au
Ciel, de toutes mes folles pensées ; ma retraite est
résolue, et je ne demande qu'assez de vie pour pouvoir
expier la faute que j'ai faite, et mériter, par une austère
pénitence, le pardon de l'aveuglement où m'ont plongée
les transports d'une passion condamnable. Mais, dans
cette retraite, j'aurais une douleur extrême qu'une
personne que j'ai chérie tendrement devînt un exemple
funeste de la justice du Ciel ; et ce me sera une joie
incroyable si je puis vous porter à détourner de dessus
votre tête l'épouvantable coup qui vous menace. De
grâce, Don Juan, accordez-moi, pour dernière faveur,
cette douce consolation ; ne me refusez point votre salut,
que je vous demande avec larmes ; et si vous n'êtes point
touché de votre intérêt, soyez-le au moins de mes prières,
et m'épargnez le cruel déplaisir de vous voir condamner à
des supplices éternels."
SGANARELLE,"Pauvre femme ! 
DONA"
ELVIRE,"Je vous ai aimé avec une tendresse extrême, rien au
monde ne m'a été si cher que vous ; j'ai oublié mon
devoir pour vous, j'ai fait toutes choses pour vous ; et
toute la récompense que je vous en demande, c'est de
corriger votre vie, et de prévenir votre perte.
Sauvez-vous, je vous prie, ou pour l'amour de vous, ou
pour l'amour de moi. Encore une fois, Don Juan, je vous
le demande avec larmes ; et si ce n'est assez des larmes
d'une personne que vous avez aimée, je vous en conjure
par tout ce qui est le plus capable de vous toucher. 
- 66 -"
SGANARELLE,"Coeur de tigre ! 
DONA"
ELVIRE,"Je m'en vais, après ce discours, et voilà tout ce que j'avais
à vous dire."
DON JUAN,"Madame, il est tard, demeurez ici : on vous y logera le
mieux qu'on pourra. 
DONA"
ELVIRE,"Non, Don Juan, ne me retenez pas davantage."
DON JUAN,"Madame, vous me ferez plaisir de demeurer, je vous
assure. 
DONA"
ELVIRE,"Non, vous dis-je, ne perdons point de temps en discours
superflus. Laissez-moi vite aller, ne faites aucune
instance pour me conduire, et songez seulement à profiter
de mon avis. 
SCÈNE VII.
Don Juan, Sganarelle, suite."
DON JUAN,"Sais-tu bien que j'ai encore senti quelque peu d'émotion
pour elle, que j'ai trouvé de l'agrément dans cette
nouveauté bizarre, et que son habit négligé, son air
languissant et ses larmes ont réveillé en moi quelques
petits restes d'un feu éteint ?"
SGANARELLE,"C'est-à-dire que ses paroles n'ont fait aucun effet sur
vous."
DON JUAN,Vite à souper.
SGANARELLE,"Fort bien. 
- 67 -"
SGANARELLE,Oui-da !
DON JUAN,"Oui, ma foi ! Il faut s'amender ; encore vingt ou trente
ans de cette vie-ci, et puis nous songerons à nous."
SGANARELLE,Oh !
DON JUAN,Qu'en dis-tu ?
SGANARELLE,"Rien. Voilà le souper. 
Il prend un morceau d'un des plats qu'on apporte et le met dans sa bouche."
DON JUAN,"Il me semble que tu as la joue enflée ; qu'est-ce que c'est
? Parle donc, qu'as-tu là ?"
SGANARELLE,Rien.
DON JUAN,"Montre un peu. Parbleu ! C'est une fluxion qui lui est
tombée sur la joue. Vite une lancette pour percer cela. Le
pauvre garçon n'en peut plus, et cet abcès le pourrait
étouffer. Attends : voyez comme il était mûr. Ah !
Coquin que vous êtes !"
SGANARELLE,"Ma foi ! Monsieur, je voulais voir si votre cuisinier
n'avait point mis trop de sel ou trop de poivre."
DON JUAN,"Allons, mets-toi là, et mange. J'ai affaire de toi quand
j'aurai soupé. Tu as faim, à ce que je vois."
SGANARELLE,"se met à table.
Je le crois bien, Monsieur : je n'ai point mangé depuis ce
matin. Tâtez de cela, voilà qui est le meilleur du monde. 
- 68 -"
DON JUAN,Qui peut frapper de cette sorte ?
SGANARELLE,Qui diable nous vient troubler dans notre repas ?
DON JUAN,"Je veux souper en repos au moins, et qu'on ne laisse
entrer personne."
SGANARELLE,"Laissez-moi faire, je m'y en vais moi-même."
DON JUAN,Qu'est-ce donc ? Qu'y a-t-il ?
DON JUAN,"Allons voir, et montrons que rien ne me saurait ébranler."
SGANARELLE,"Ah ! Pauvre Sganarelle, ou te cacheras-tu ? 
- 69 -"
DON JUAN,"Une chaise et un couvert, vite donc. 
À Sganarelle.
Allons, mets-toi à table."
SGANARELLE,"Monsieur, je n'ai plus de faim."
DON JUAN,"Mets-toi là, te dis-je. À boire. À la santé du Commandeur
: je te la porte, Sganarelle. Qu'on lui donne du vin."
SGANARELLE,"Monsieur, je n'ai pas soif."
DON JUAN,"Bois, et chante ta chanson, pour régaler le Commandeur."
SGANARELLE,"Je suis enrhumé, Monsieur."
DON JUAN,"Il n'importe. Allons. Vous autres, venez, accompagnez sa
voix. 
LA STATUE
Don Juan, c'est assez. Je vous invite à venir demain
souper avec moi. En aurez-vous le courage ?"
DON JUAN,"Oui, j'irai, accompagné du seul Sganarelle."
SGANARELLE,"Je vous rends grâce, il est demain jeûne pour moi."
DON LOUIS,"Quoi ? Mon fils, serait-il possible que la bonté du Ciel
eût exaucé mes voux ? Ce que vous me dites est-il bien
vrai ? Ne m'abusez-vous point d'un faux espoir, et puis-je
prendre quelque assurance sur la nouveauté surprenante
d'une telle conversion ?"
DON LOUIS,"Ah ! Mon fils, que la tendresse d'un père est aisément
rappelée, et que les offenses d'un fils s'évanouissent vite
au moindre mot de repentir ! Je ne me souviens plus déjà
de tous les déplaisirs que vous m'avez donnés, et tout est
effacé par les paroles que vous venez de me faire
entendre. Je ne me sens pas, je l'avoue ; je jette des
larmes de joie ; tous mes voux sont satisfaits, et je n'ai
plus rien désormais à demander au Ciel. Embrassez-moi,
mon fils, et persistez, je vous conjure, dans cette louable
pensée. Pour moi, j'en vais tout de ce pas porter
- 72 -"
SGANARELLE,"Ah ! Monsieur, que j'ai de joie de vous voir converti ! Il y
a longtemps que j'attendais cela, et voilà, grâce au Ciel,
tous mes souhaits accomplis."
DON JUAN,La peste le benêt !
SGANARELLE,"Comment, le benêt ?"
DON JUAN,"Quoi ? Tu prends pour de bon argent ce que je viens de
dire, et tu crois que ma bouche était d'accord avec mon
coeur ?"
SGANARELLE,"Quoi ? Ce n'est pas... Vous ne... Votre... Oh ! Quel
homme ! Quel homme ! Quel homme !"
DON JUAN,"Non, non, je ne suis point changé, et mes sentiments sont
toujours les mêmes."
SGANARELLE,"Vous ne vous rendez pas à la surprenante merveille de
cette statue mouvante et parlante ?"
